{
  "schema_version": "trustweave.dev/v1alpha1",
  "name": "synthetic-manifest-only-tool-agent",
  "description": "A local-only synthetic manifest for reverse-direction static label comparison; it does not describe a deployed application.",
  "sources": [
    {
      "name": "synthetic_request",
      "trust": "trusted",
      "data_classification": "public",
      "description": "A harmless synthetic request used only to satisfy the manifest contract."
    }
  ],
  "tools": [
    {
      "name": "knowledge_search",
      "action_class": "read",
      "capabilities": ["knowledge.read"],
      "description": "A declared synthetic retrieval label; no lookup is performed."
    },
    {
      "name": "ticket_draft",
      "action_class": "write",
      "capabilities": ["ticket.draft"],
      "description": "A declared synthetic drafting label; no ticket is created."
    },
    {
      "name": "customer_lookup",
      "action_class": "sensitive",
      "capabilities": ["customer.read"],
      "description": "A declared synthetic customer-record label; no record is accessed."
    },
    {
      "name": "audit_log",
      "action_class": "write",
      "capabilities": ["audit.draft"],
      "description": "A declared synthetic audit label; no log entry is created."
    }
  ],
  "flows": [
    {
      "source": "synthetic_request",
      "tool": "knowledge_search",
      "purpose": "Provide a minimally valid local manifest for static label comparison."
    }
  ]
}
