{
  "schema_version": "trustweave.dev/v1alpha1",
  "name": "synthetic-partial-reconciliation-agent",
  "description": "A local-only synthetic manifest for partial reconciliation comparison; it does not describe a deployed application.",
  "sources": [
    {
      "name": "synthetic_request",
      "trust": "trusted",
      "data_classification": "public",
      "description": "A harmless synthetic request used only to satisfy the manifest contract."
    }
  ],
  "tools": [
    {
      "name": "data_retrieve",
      "action_class": "read",
      "capabilities": ["data.read"],
      "description": "A declared synthetic retrieval label; no data is retrieved."
    },
    {
      "name": "knowledge_search",
      "action_class": "read",
      "capabilities": ["knowledge.read"],
      "description": "A declared synthetic retrieval label; no lookup is performed."
    },
    {
      "name": "open_ticket",
      "action_class": "write",
      "capabilities": ["ticket.write"],
      "description": "A declared synthetic ticket label; no ticket is opened."
    },
    {
      "name": "push_alert",
      "action_class": "external",
      "capabilities": ["alert.send"],
      "description": "A declared synthetic alert label; no alert is sent."
    }
  ],
  "flows": [
    {
      "source": "synthetic_request",
      "tool": "knowledge_search",
      "purpose": "Provide a minimally valid local manifest for partial reconciliation comparison."
    }
  ]
}
